{
  "scenario": "worldengine-full-lifecycle-autonomous",
  "goal": "Validate WorldEngine can create, run, and evidence an autonomous-agent world lifecycle.",
  "mode": "scorecard_autonomous",
  "status": "pass",
  "verdict_source": "scorecard_checker",
  "score_items": [
    {
      "name": "world_created",
      "status": "pass",
      "evidence": "world-lifecycle-summary.json"
    },
    {
      "name": "runtime_progressed",
      "status": "pass",
      "evidence": "world-lifecycle-summary.json"
    },
    {
      "name": "agent_autonomy_observed",
      "status": "pass",
      "evidence": "world-lifecycle-summary.json"
    },
    {
      "name": "external_direction_bounded",
      "status": "pass",
      "evidence": "world-lifecycle-summary.json"
    }
  ],
  "required_artifacts": [
    "transcript",
    "console_log",
    "scorecard_summary",
    "operation_log",
    "api_summary",
    "world_lifecycle_summary",
    "screenshots"
  ],
  "artifacts": {
    "transcript": "transcript.md",
    "console_log": "console.log",
    "scorecard_summary": "scorecard-summary.json",
    "operation_log": "operation-log.jsonl",
    "api_summary": "api-summary.json",
    "world_lifecycle_summary": "world-lifecycle-summary.json",
    "screenshots": [
      "screenshots/runtime-console.png"
    ]
  },
  "operation_log": "operation-log.jsonl",
  "unverified_items": [],
  "failures": []
}
