{
  "scenario": "autonomous-dashboard-basic-runtime",
  "goal": "Confirm that the dashboard can advance runtime once and expose timeline evidence.",
  "mode": "scorecard_autonomous",
  "status": "pass",
  "verdict_source": "scorecard_checker",
  "score_items": [
    {
      "name": "opened dashboard",
      "status": "pass",
      "evidence": {
        "source": "operation-log.jsonl",
        "target": "dashboard"
      }
    },
    {
      "name": "advanced runtime through UI",
      "status": "pass",
      "evidence": {
        "source": "operation-log.jsonl",
        "target": "runtime-step-button"
      }
    },
    {
      "name": "found timeline evidence",
      "status": "pass",
      "evidence": {
        "source": "operation-log.jsonl",
        "target": "timeline-panel"
      }
    }
  ],
  "required_artifacts": [
    "transcript",
    "console_log",
    "scorecard_summary",
    "operation_log",
    "screenshots"
  ],
  "artifacts": {
    "transcript": "transcript.md",
    "console_log": "console.log",
    "scorecard_summary": "scorecard-summary.json",
    "operation_log": "operation-log.jsonl",
    "screenshots": [
      "screenshots/dashboard-basic-runtime.svg"
    ]
  },
  "operation_log": "operation-log.jsonl",
  "unverified_items": [],
  "failures": []
}
